{
  "schema_version": "2.0.0",
  "doctrina_version": "2026.08.02",
  "metadatos": {
    "titulo": "Anatomía de un harness de trabajo con IA",
    "descripcion_producto": "Taller guiado que diagnostica, planifica y deja decisiones, artefactos y evidencia para el harness de trabajo con IA de una persona, programe o no.",
    "no_es": "No es una plantilla que implemente los subsistemas de una aplicación de IA.",
    "limitacion_evidencia": "La evidencia interna procede de cuatro proyectos relacionados, con autor y asistente compartidos; n=4 no independiente. Se usa para formular hipótesis y preguntas, no causalidades universales.",
    "fuentes_historicas": [
      "historia/investigacion/external_best_practices.md",
      "historia/diagramas/anatomia_datos_v2.js",
      "evidencia interna n=4 · los cuatro dossiers y los informes que los sintetizaron se retiraron del arbol el 2026-08-04 por ser fuente de proyectos propios; la doctrina que salio de ellos es la que hay, y su procedencia primaria ya no es consultable aqui"
    ],
    "generados": [
      "datos/anatomia.js",
      "datos/indice_piezas.json",
      "taller/prompts/"
    ],
    "fuente_contenido": "diagramas/diagrama_base.html (volcado del 2026-08-02); desde esta versión el diagrama consume este fichero y no tiene datos propios.",
    "ejemplo_hilo": "Un ayudante para responder el correo. Llega un mensaje. Él mira de qué proyecto habla, en qué punto está y qué te piden. Escribe un borrador. Tú lo lees, lo corriges y lo envías. Él nunca envía nada por su cuenta.\n\nEse ayudante no viene hecho. Las 18 piezas de este diagrama son lo que hay que decidir para construirlo. Y sirven igual para cualquier otro trabajo."
  },
  "centro": {
    "nombre": "Tu trabajo con IA",
    "subtitulo": "qué quieres conseguir y cómo sabrás que ayuda",
    "icono": "🎯",
    "resumen": "Un harness es lo que convierte un asistente general en un colaborador que entiende tu trabajo.\n\nNo viene hecho. Lo construyes tú: propósito, contexto, instrucciones, conocimiento, memoria, formas de trabajo, límites, comprobaciones y aprendizaje.\n\nEste diagrama son las 18 decisiones que hay que tomar. Se lee de dentro hacia fuera.",
    "resumen_html": "Un harness es lo que convierte un asistente general en un colaborador que entiende <b>tu</b> trabajo.<br><br>No viene hecho. Lo construyes tú: propósito, contexto, instrucciones, conocimiento, memoria, formas de trabajo, límites, comprobaciones y aprendizaje.<br><br><b>Este diagrama son las 18 decisiones que hay que tomar.</b> Se lee de dentro hacia fuera.",
    "ejemplo": "Un ayudante para responder el correo. Llega un mensaje. Él mira de qué proyecto habla, en qué punto está y qué te piden. Escribe un borrador. Tú lo lees, lo corriges y lo envías. <b>Él nunca envía nada por su cuenta.</b><br><br>Ese ayudante no viene hecho. Las 18 piezas de este diagrama son lo que hay que decidir para construirlo. <b>Y sirven igual para cualquier otro trabajo.</b>",
    "principios": [
      "<b>El centro es tu trabajo</b>, no el modelo. Qué quieres conseguir, para quién, con qué límites y cómo sabrás que ayuda.",
      "<b>1 · Orientación</b> — qué debe entender.",
      "<b>2 · Capacidades</b> — qué puede hacer y quién manda.",
      "<b>3 · Confianza</b> — cómo sabes que está bien.",
      "<b>4 · Continuidad</b> — cómo sigue vivo.",
      "<b>Son preguntas, no tareas obligatorias.</b> Una pieza puede ser necesaria, opcional, posterior o no aplicable. Pero conviene evaluarla y dejar escrito por qué, en vez de saltársela.",
      "<b>Si solo te llevas una idea:</b> el mejor harness no es el que más automatiza. Es el que te ayuda a trabajar mejor, actúa dentro de límites conscientes, deja resultados verificables y aprende sin perder su historia."
    ],
    "industria": "<p>Anthropic define un <i>agent harness</i> como el sistema que permite actuar al modelo: procesa entradas, orquesta herramientas y devuelve resultados. E identifica Claude Code como un harness flexible. <b>Ahí el bucle general ya está resuelto</b>: lo que cada persona construye encima es la capa de su trabajo.</p><p>NIST sitúa misión, alcance, responsabilidades y tolerancia al riesgo <b>antes</b> de las actividades de medida. Por eso el centro de este diagrama es el trabajo, no la tecnología.</p><cite>Anthropic, <a href='https://www.anthropic.com/engineering/demystifying-evals-for-ai-agents'>Demystifying evals for AI agents</a> · NIST, <a href='https://airc.nist.gov/airmf-resources/airmf/5-sec-core/'>AI Risk Management Framework Core</a></cite>",
    "casos": "<p>La doctrina de este diagrama sale de cuatro proyectos reales, muy distintos entre sí: uno en producción con comprobación automática, una demo montada en un día, el sistema con el que una consultoría lleva su propio negocio y un entorno con el que una persona opera una plataforma de datos sin escribir programa alguno.</p><p>Los cuatro llegaron por caminos distintos a la misma frontera, que uno de ellos tiene escrita en una línea:</p><p style='font-family:Georgia,serif;font-size:15.5px;color:#2b2b2b;text-align:center;padding:8px 0'>«datos e integridad → código;<br>juicio y matiz → IA»</p><p>Es decir: <b>lo que se puede calcular o comprobar, lo hace el código; lo que requiere criterio, lo hace el modelo.</b></p><p><b>El caso que más ha cambiado este diagrama es el que no tiene programa propio.</b> Aun así tiene un harness completo. Cualquier pieza escrita como «programa algo que…» lo dejaba fuera — y con él a la mayoría de la gente.</p>",
    "limitacion_evidencia": "Las piezas salen de la documentación pública de quienes construyen estas herramientas y del análisis de cuatro proyectos reales.<br><br><b>Límites de la evidencia interna:</b> los cuatro comparten autor y asistente, así que <b>n=4 y no independiente</b>. Ninguno tenía usuarios finales a diario. Sirve para formular hipótesis, no para demostrar causalidades.<br><br>Cuando una observación interna aparece en una ficha, va etiquetada como observación."
  },
  "anillos": [
    {
      "id": 1,
      "nombre": "Orientación",
      "pregunta": "¿Qué debe entender para ayudarte bien?",
      "radio": 15,
      "descripcion": "Lo que sabe antes de empezar.\n\nQuién eres y qué haces. Qué recuerda de otras veces. Con qué instrucciones trabaja. De dónde saca los datos. Qué no debe tocar.\n\nSi esto entra bien, los otros tres anillos tienen mucho menos trabajo.",
      "descripcion_html": "Lo que sabe antes de empezar.<br><br>Quién eres y qué haces. Qué recuerda de otras veces. Con qué instrucciones trabaja. De dónde saca los datos. Qué no debe tocar.<br><br><b>Si esto entra bien, los otros tres anillos tienen mucho menos trabajo.</b>",
      "ejemplo": "Sabe que gestionas proyectos, recuerda lo hablado con ese cliente, tiene tus reglas de estilo, consulta la ficha del proyecto y no saca datos personales de ahí.",
      "puntos_clave": [
        "El error típico: darle de más «por si acaso». Elegir qué entra es trabajo, no pereza.",
        "Cinco preguntas: qué entiende, qué recuerda, qué reglas sigue, de dónde saca los datos, qué no cruza.",
        "Por aquí también te pueden atacar. Por eso los límites están en este anillo y no al final.",
        "No hace falta programar para responder estas cinco."
      ]
    },
    {
      "id": 2,
      "nombre": "Capacidades",
      "pregunta": "¿Cómo trabaja, qué puede hacer y quién manda?",
      "radio": 27.1,
      "descripcion": "Lo que pasa desde que pides algo hasta que hay resultado.\n\nSobre qué plataforma. Con qué herramientas. Qué deja hecho. Y en qué momentos decides tú.\n\nEl reparto de control lo decides tú, no el modelo.",
      "descripcion_html": "Lo que pasa desde que pides algo hasta que hay resultado.<br><br>Sobre qué plataforma. Con qué herramientas. Qué deja hecho. Y en qué momentos decides tú.<br><br><b>El reparto de control lo decides tú, no el modelo.</b>",
      "ejemplo": "Trabaja en tu portátil. Puede leer la carpeta del proyecto. No puede enviar correos. Deja el borrador en un fichero y espera tu visto bueno.",
      "puntos_clave": [
        "Empieza por lo más simple que funcione. La automatización se añade cuando repetir duele.",
        "«Puede hacerlo» y «puede hacerlo sin preguntar» son dos decisiones distintas.",
        "El resultado no siempre es texto: puede ser un fichero, una decisión o una acción con efectos.",
        "Cuanta más autonomía des, más barato tiene que ser comprobar."
      ]
    },
    {
      "id": 3,
      "nombre": "Confianza",
      "pregunta": "¿Cómo sabes que está bien?",
      "radio": 34.1,
      "descripcion": "Cómo compruebas lo que sale y qué te cuesta comprobarlo.\n\nSin esto no tienes un harness: tienes algo que funcionó una vez.\n\nY ojo: el mecanismo que comprueba también puede estar mal.",
      "descripcion_html": "Cómo compruebas lo que sale y qué te cuesta comprobarlo.<br><br>Sin esto no tienes un harness: tienes algo que funcionó una vez.<br><br><b>Y ojo: el mecanismo que comprueba también puede estar mal.</b>",
      "ejemplo": "Tienes seis correos reales con la respuesta que diste tú. Revisar un borrador te lleva dos minutos. Cada corrección queda anotada.",
      "puntos_clave": [
        "Comprobar cuesta: tu tiempo, la espera, el dinero. Ese precio decide cuánta autonomía te puedes permitir.",
        "No hace falta escribir tests. Hacen falta ejemplos reales y saber qué cuenta como bien hecho.",
        "Si automatizas la revisión, alguien tiene que revisar al revisor.",
        "Lo que corriges es la mejor información que tienes. Si no se anota, se pierde."
      ]
    },
    {
      "id": 4,
      "nombre": "Continuidad",
      "pregunta": "¿Cómo sigue vivo dentro de seis meses?",
      "radio": 44.47,
      "descripcion": "Lo que hace que el harness no se evapore.\n\nDónde vive su configuración. Qué fallos ya tiene previstos. Cómo se recupera. Cuándo se revisa o se retira.\n\nEsto no es el andamio: es la forma concreta que tiene tu harness.",